[
  {
    "id": "ev-1",
    "source_id": "synthetic-source-1",
    "source_type": "fixture",
    "originator": "synthetic-wire",
    "canonical_story_id": "synthetic-wire-lab",
    "url": "https://example.com/evidence/1",
    "published_at": "2026-09-25T20:30:00Z",
    "known_at": "2026-09-25T20:30:00Z",
    "hash": "sha256:a6adf2b52d3bd62af3ff72da5023545ad9ba380100035a3d4731391e6094197e",
    "license_tag": "synthetic",
    "excerpt": "Synthela 03 announced a new laboratory; this article reproduces the original wire story."
  },
  {
    "id": "ev-2",
    "source_id": "synthetic-source-2",
    "source_type": "fixture",
    "originator": "synthetic-wire",
    "canonical_story_id": "synthetic-wire-lab",
    "url": "https://example.com/evidence/2",
    "published_at": "2026-09-25T20:30:00Z",
    "known_at": "2026-09-25T20:30:00Z",
    "hash": "sha256:a6adf2b52d3bd62af3ff72da5023545ad9ba380100035a3d4731391e6094197e",
    "license_tag": "synthetic",
    "excerpt": "Synthela 03 announced a new laboratory; this article reproduces the original wire story."
  },
  {
    "id": "ev-3",
    "source_id": "synthetic-source-3",
    "source_type": "fixture",
    "originator": "synthetic-wire",
    "canonical_story_id": "synthetic-wire-lab",
    "url": "https://example.com/evidence/3",
    "published_at": "2026-09-25T20:30:00Z",
    "known_at": "2026-09-25T20:30:00Z",
    "hash": "sha256:a6adf2b52d3bd62af3ff72da5023545ad9ba380100035a3d4731391e6094197e",
    "license_tag": "synthetic",
    "excerpt": "Synthela 03 announced a new laboratory; this article reproduces the original wire story."
  },
  {
    "id": "ev-4",
    "source_id": "synthetic-source-4",
    "source_type": "fixture",
    "originator": "synthetic-wire",
    "canonical_story_id": "synthetic-wire-lab",
    "url": "https://example.com/evidence/4",
    "published_at": "2026-09-25T20:30:00Z",
    "known_at": "2026-09-25T20:30:00Z",
    "hash": "sha256:a6adf2b52d3bd62af3ff72da5023545ad9ba380100035a3d4731391e6094197e",
    "license_tag": "synthetic",
    "excerpt": "Synthela 03 announced a new laboratory; this article reproduces the original wire story."
  },
  {
    "id": "ev-5",
    "source_id": "synthetic-source-5",
    "source_type": "fixture",
    "originator": "synthetic-wire",
    "canonical_story_id": "synthetic-wire-lab",
    "url": "https://example.com/evidence/5",
    "published_at": "2026-09-25T20:30:00Z",
    "known_at": "2026-09-25T20:30:00Z",
    "hash": "sha256:a6adf2b52d3bd62af3ff72da5023545ad9ba380100035a3d4731391e6094197e",
    "license_tag": "synthetic",
    "excerpt": "Synthela 03 announced a new laboratory; this article reproduces the original wire story."
  },
  {
    "id": "ev-6",
    "source_id": "synthetic-source-6",
    "source_type": "fixture",
    "originator": "synthetic-wire",
    "canonical_story_id": "synthetic-wire-lab",
    "url": "https://example.com/evidence/6",
    "published_at": "2026-09-25T20:30:00Z",
    "known_at": "2026-09-25T20:30:00Z",
    "hash": "sha256:a6adf2b52d3bd62af3ff72da5023545ad9ba380100035a3d4731391e6094197e",
    "license_tag": "synthetic",
    "excerpt": "Synthela 03 announced a new laboratory; this article reproduces the original wire story."
  },
  {
    "id": "ev-7",
    "source_id": "synthetic-source-7",
    "source_type": "fixture",
    "originator": "synthetic-wire",
    "canonical_story_id": "synthetic-wire-lab",
    "url": "https://example.com/evidence/7",
    "published_at": "2026-09-25T20:30:00Z",
    "known_at": "2026-09-25T20:30:00Z",
    "hash": "sha256:a6adf2b52d3bd62af3ff72da5023545ad9ba380100035a3d4731391e6094197e",
    "license_tag": "synthetic",
    "excerpt": "Synthela 03 announced a new laboratory; this article reproduces the original wire story."
  },
  {
    "id": "ev-8",
    "source_id": "synthetic-source-8",
    "source_type": "fixture",
    "originator": "synthetic-wire",
    "canonical_story_id": "synthetic-wire-lab",
    "url": "https://example.com/evidence/8",
    "published_at": "2026-09-25T20:30:00Z",
    "known_at": "2026-09-25T20:30:00Z",
    "hash": "sha256:a6adf2b52d3bd62af3ff72da5023545ad9ba380100035a3d4731391e6094197e",
    "license_tag": "synthetic",
    "excerpt": "Synthela 03 announced a new laboratory; this article reproduces the original wire story."
  },
  {
    "id": "ev-9",
    "source_id": "synthetic-source-9",
    "source_type": "fixture",
    "originator": "synthetic-wire",
    "canonical_story_id": "synthetic-wire-lab",
    "url": "https://example.com/evidence/9",
    "published_at": "2026-09-25T20:30:00Z",
    "known_at": "2026-09-25T20:30:00Z",
    "hash": "sha256:a6adf2b52d3bd62af3ff72da5023545ad9ba380100035a3d4731391e6094197e",
    "license_tag": "synthetic",
    "excerpt": "Synthela 03 announced a new laboratory; this article reproduces the original wire story."
  },
  {
    "id": "ev-10",
    "source_id": "synthetic-source-10",
    "source_type": "fixture",
    "originator": "synthetic-wire",
    "canonical_story_id": "synthetic-wire-lab",
    "url": "https://example.com/evidence/10",
    "published_at": "2026-09-25T20:30:00Z",
    "known_at": "2026-09-25T20:30:00Z",
    "hash": "sha256:a6adf2b52d3bd62af3ff72da5023545ad9ba380100035a3d4731391e6094197e",
    "license_tag": "synthetic",
    "excerpt": "Synthela 03 announced a new laboratory; this article reproduces the original wire story."
  }
]
